{
  "schemaVersion": 1,
  "decisionId": "HDR-8d92fff11a714432-8d662a00",
  "workItemId": "interactive-installation-calibration-wizard-plan",
  "status": "needs_human_confirmation",
  "category": "preflight_review",
  "severity": "medium",
  "whatHappened": [
    "Acceptance: 1 acceptance item(s) are broad or underspecified"
  ],
  "whyItMatters": "Continuing would require a human decision about behavior or scope.",
  "evidence": [
    {
      "type": "preflight_signal",
      "reference": "Intent: problem, constraints, and rationale are all present"
    },
    {
      "type": "preflight_signal",
      "reference": "Raw Request: raw request, declared intent, and repository capabilities are aligned"
    },
    {
      "type": "preflight_signal",
      "reference": "Intent Capability: operation policy repository_governance.modify derives required capabilities: ai_governance, software_design"
    },
    {
      "type": "preflight_signal",
      "reference": "Capability: declared capabilities cover: ai_governance, documentation"
    },
    {
      "type": "preflight_signal",
      "reference": "Intent Guard: intent is specific enough for deterministic review"
    },
    {
      "type": "preflight_signal",
      "reference": "Constraint Guard: declared constraints do not conflict"
    },
    {
      "type": "preflight_signal",
      "reference": "Success Criteria: no project-owned criteria are assigned to interactive-installation-calibration-wizard-plan"
    },
    {
      "type": "preflight_signal",
      "reference": "Critical Domain Guard: no critical-domain operation is declared"
    },
    {
      "type": "preflight_signal",
      "reference": "Governance Bypass Guard: no governance bypass request is declared"
    },
    {
      "type": "preflight_signal",
      "reference": "Evidence Integrity Guard: no evidence-forgery or chat-only approval request is declared"
    },
    {
      "type": "preflight_signal",
      "reference": "Production Operation Guard: no external production operation is declared"
    },
    {
      "type": "preflight_signal",
      "reference": "Unknowns: no unknowns are declared for a low-risk Work Item"
    },
    {
      "type": "preflight_signal",
      "reference": "Acceptance: 1 acceptance item(s) are broad or underspecified"
    },
    {
      "type": "preflight_signal",
      "reference": "Sources: 6 source(s) of evidence are declared"
    },
    {
      "type": "preflight_signal",
      "reference": "Scenario Coverage: 3 required scenario(s) are verified or not_applicable"
    },
    {
      "type": "preflight_signal",
      "reference": "Verification: verification declares 16 required check(s)"
    }
  ],
  "options": [
    {
      "id": "A",
      "label": "Clarify the missing decision",
      "risk": "unknown",
      "consequence": "Update the Contract before implementation."
    },
    {
      "id": "B",
      "label": "Reduce the Work Item scope",
      "risk": "unknown",
      "consequence": "Continue only with the confirmed portion of the work."
    },
    {
      "id": "C",
      "label": "Defer this Work Item",
      "risk": "unknown",
      "consequence": "Keep the Work Item open without implementation."
    }
  ],
  "recommendedOption": "A",
  "recommendationReason": "The missing evidence should be resolved before implementation behavior is chosen.",
  "question": "Should I clarify the missing decision in the Contract before implementation?",
  "resumeCondition": "A human decision is recorded and the Preflight Review becomes ready."
}
